{
  "molssi_bse_schema": {
    "schema_type": "table",
    "schema_version": "0.1"
  },
  "revision_description": "Data from https://zenodo.org/records/7574629",
  "revision_date": "2024-11-17",
  "elements": {
    "1": "dyall/dyall-ae2z.1.element.json",
    "2": "dyall/dyall-ae2z.1.element.json",
    "3": "dyall/dyall-ae2z.1.element.json",
    "4": "dyall/dyall-ae2z.1.element.json",
    "5": "dyall/dyall-ae2z.1.element.json",
    "6": "dyall/dyall-ae2z.1.element.json",
    "7": "dyall/dyall-ae2z.1.element.json",
    "8": "dyall/dyall-ae2z.1.element.json",
    "9": "dyall/dyall-ae2z.1.element.json",
    "10": "dyall/dyall-ae2z.1.element.json",
    "11": "dyall/dyall-ae2z.1.element.json",
    "12": "dyall/dyall-ae2z.1.element.json",
    "13": "dyall/dyall-ae2z.1.element.json",
    "14": "dyall/dyall-ae2z.1.element.json",
    "15": "dyall/dyall-ae2z.1.element.json",
    "16": "dyall/dyall-ae2z.1.element.json",
    "17": "dyall/dyall-ae2z.1.element.json",
    "18": "dyall/dyall-ae2z.1.element.json",
    "19": "dyall/dyall-ae2z.1.element.json",
    "20": "dyall/dyall-ae2z.1.element.json",
    "21": "dyall/dyall-ae2z.1.element.json",
    "22": "dyall/dyall-ae2z.1.element.json",
    "23": "dyall/dyall-ae2z.1.element.json",
    "24": "dyall/dyall-ae2z.1.element.json",
    "25": "dyall/dyall-ae2z.1.element.json",
    "26": "dyall/dyall-ae2z.1.element.json",
    "27": "dyall/dyall-ae2z.1.element.json",
    "28": "dyall/dyall-ae2z.1.element.json",
    "29": "dyall/dyall-ae2z.1.element.json",
    "30": "dyall/dyall-ae2z.1.element.json",
    "31": "dyall/dyall-ae2z.1.element.json",
    "32": "dyall/dyall-ae2z.1.element.json",
    "33": "dyall/dyall-ae2z.1.element.json",
    "34": "dyall/dyall-ae2z.1.element.json",
    "35": "dyall/dyall-ae2z.1.element.json",
    "36": "dyall/dyall-ae2z.1.element.json",
    "37": "dyall/dyall-ae2z.1.element.json",
    "38": "dyall/dyall-ae2z.1.element.json",
    "39": "dyall/dyall-ae2z.1.element.json",
    "40": "dyall/dyall-ae2z.1.element.json",
    "41": "dyall/dyall-ae2z.1.element.json",
    "42": "dyall/dyall-ae2z.1.element.json",
    "43": "dyall/dyall-ae2z.1.element.json",
    "44": "dyall/dyall-ae2z.1.element.json",
    "45": "dyall/dyall-ae2z.1.element.json",
    "46": "dyall/dyall-ae2z.1.element.json",
    "47": "dyall/dyall-ae2z.1.element.json",
    "48": "dyall/dyall-ae2z.1.element.json",
    "49": "dyall/dyall-ae2z.1.element.json",
    "50": "dyall/dyall-ae2z.1.element.json",
    "51": "dyall/dyall-ae2z.1.element.json",
    "52": "dyall/dyall-ae2z.1.element.json",
    "53": "dyall/dyall-ae2z.1.element.json",
    "54": "dyall/dyall-ae2z.1.element.json",
    "55": "dyall/dyall-ae2z.1.element.json",
    "56": "dyall/dyall-ae2z.1.element.json",
    "57": "dyall/dyall-ae2z.1.element.json",
    "58": "dyall/dyall-ae2z.1.element.json",
    "59": "dyall/dyall-ae2z.1.element.json",
    "60": "dyall/dyall-ae2z.1.element.json",
    "61": "dyall/dyall-ae2z.1.element.json",
    "62": "dyall/dyall-ae2z.1.element.json",
    "63": "dyall/dyall-ae2z.1.element.json",
    "64": "dyall/dyall-ae2z.1.element.json",
    "65": "dyall/dyall-ae2z.1.element.json",
    "66": "dyall/dyall-ae2z.1.element.json",
    "67": "dyall/dyall-ae2z.1.element.json",
    "68": "dyall/dyall-ae2z.1.element.json",
    "69": "dyall/dyall-ae2z.1.element.json",
    "70": "dyall/dyall-ae2z.1.element.json",
    "71": "dyall/dyall-ae2z.1.element.json",
    "72": "dyall/dyall-ae2z.1.element.json",
    "73": "dyall/dyall-ae2z.1.element.json",
    "74": "dyall/dyall-ae2z.1.element.json",
    "75": "dyall/dyall-ae2z.1.element.json",
    "76": "dyall/dyall-ae2z.1.element.json",
    "77": "dyall/dyall-ae2z.1.element.json",
    "78": "dyall/dyall-ae2z.1.element.json",
    "79": "dyall/dyall-ae2z.1.element.json",
    "80": "dyall/dyall-ae2z.1.element.json",
    "81": "dyall/dyall-ae2z.1.element.json",
    "82": "dyall/dyall-ae2z.1.element.json",
    "83": "dyall/dyall-ae2z.1.element.json",
    "84": "dyall/dyall-ae2z.1.element.json",
    "85": "dyall/dyall-ae2z.1.element.json",
    "86": "dyall/dyall-ae2z.1.element.json",
    "87": "dyall/dyall-ae2z.1.element.json",
    "88": "dyall/dyall-ae2z.1.element.json",
    "89": "dyall/dyall-ae2z.1.element.json",
    "90": "dyall/dyall-ae2z.1.element.json",
    "91": "dyall/dyall-ae2z.1.element.json",
    "92": "dyall/dyall-ae2z.1.element.json",
    "93": "dyall/dyall-ae2z.1.element.json",
    "94": "dyall/dyall-ae2z.1.element.json",
    "95": "dyall/dyall-ae2z.1.element.json",
    "96": "dyall/dyall-ae2z.1.element.json",
    "97": "dyall/dyall-ae2z.1.element.json",
    "98": "dyall/dyall-ae2z.1.element.json",
    "99": "dyall/dyall-ae2z.1.element.json",
    "100": "dyall/dyall-ae2z.1.element.json",
    "101": "dyall/dyall-ae2z.1.element.json",
    "102": "dyall/dyall-ae2z.1.element.json",
    "103": "dyall/dyall-ae2z.1.element.json",
    "104": "dyall/dyall-ae2z.1.element.json",
    "105": "dyall/dyall-ae2z.1.element.json",
    "106": "dyall/dyall-ae2z.1.element.json",
    "107": "dyall/dyall-ae2z.1.element.json",
    "108": "dyall/dyall-ae2z.1.element.json",
    "109": "dyall/dyall-ae2z.1.element.json",
    "110": "dyall/dyall-ae2z.1.element.json",
    "111": "dyall/dyall-ae2z.1.element.json",
    "112": "dyall/dyall-ae2z.1.element.json",
    "113": "dyall/dyall-ae2z.1.element.json",
    "114": "dyall/dyall-ae2z.1.element.json",
    "115": "dyall/dyall-ae2z.1.element.json",
    "116": "dyall/dyall-ae2z.1.element.json",
    "117": "dyall/dyall-ae2z.1.element.json",
    "118": "dyall/dyall-ae2z.1.element.json"
  }
}