{
  "molssi_bse_schema": {
    "schema_type": "table",
    "schema_version": "0.1"
  },
  "revision_description": "Data from authors",
  "revision_date": "2024-12-04",
  "elements": {
    "1": "jorge/DZP-ZORA.1.element.json",
    "2": "jorge/DZP-ZORA.1.element.json",
    "3": "jorge/DZP-ZORA.1.element.json",
    "4": "jorge/DZP-ZORA.1.element.json",
    "5": "jorge/DZP-ZORA.1.element.json",
    "6": "jorge/DZP-ZORA.1.element.json",
    "7": "jorge/DZP-ZORA.1.element.json",
    "8": "jorge/DZP-ZORA.1.element.json",
    "9": "jorge/DZP-ZORA.1.element.json",
    "10": "jorge/DZP-ZORA.1.element.json",
    "11": "jorge/DZP-ZORA.1.element.json",
    "12": "jorge/DZP-ZORA.1.element.json",
    "13": "jorge/DZP-ZORA.1.element.json",
    "14": "jorge/DZP-ZORA.1.element.json",
    "15": "jorge/DZP-ZORA.1.element.json",
    "16": "jorge/DZP-ZORA.1.element.json",
    "17": "jorge/DZP-ZORA.1.element.json",
    "18": "jorge/DZP-ZORA.1.element.json",
    "19": "jorge/DZP-ZORA.1.element.json",
    "20": "jorge/DZP-ZORA.1.element.json",
    "21": "jorge/DZP-ZORA.1.element.json",
    "22": "jorge/DZP-ZORA.1.element.json",
    "23": "jorge/DZP-ZORA.1.element.json",
    "24": "jorge/DZP-ZORA.1.element.json",
    "25": "jorge/DZP-ZORA.1.element.json",
    "26": "jorge/DZP-ZORA.1.element.json",
    "27": "jorge/DZP-ZORA.1.element.json",
    "28": "jorge/DZP-ZORA.1.element.json",
    "29": "jorge/DZP-ZORA.1.element.json",
    "30": "jorge/DZP-ZORA.1.element.json",
    "31": "jorge/DZP-ZORA.1.element.json",
    "32": "jorge/DZP-ZORA.1.element.json",
    "33": "jorge/DZP-ZORA.1.element.json",
    "34": "jorge/DZP-ZORA.1.element.json",
    "35": "jorge/DZP-ZORA.1.element.json",
    "36": "jorge/DZP-ZORA.1.element.json",
    "37": "jorge/DZP-ZORA.1.element.json",
    "38": "jorge/DZP-ZORA.1.element.json",
    "39": "jorge/DZP-ZORA.1.element.json",
    "40": "jorge/DZP-ZORA.1.element.json",
    "41": "jorge/DZP-ZORA.1.element.json",
    "42": "jorge/DZP-ZORA.1.element.json",
    "43": "jorge/DZP-ZORA.1.element.json",
    "44": "jorge/DZP-ZORA.1.element.json",
    "45": "jorge/DZP-ZORA.1.element.json",
    "46": "jorge/DZP-ZORA.1.element.json",
    "47": "jorge/DZP-ZORA.1.element.json",
    "48": "jorge/DZP-ZORA.1.element.json",
    "49": "jorge/DZP-ZORA.1.element.json",
    "50": "jorge/DZP-ZORA.1.element.json",
    "51": "jorge/DZP-ZORA.1.element.json",
    "52": "jorge/DZP-ZORA.1.element.json",
    "53": "jorge/DZP-ZORA.1.element.json",
    "54": "jorge/DZP-ZORA.1.element.json",
    "55": "jorge/DZP-ZORA.1.element.json",
    "56": "jorge/DZP-ZORA.1.element.json",
    "57": "jorge/DZP-ZORA.1.element.json",
    "72": "jorge/DZP-ZORA.1.element.json",
    "73": "jorge/DZP-ZORA.1.element.json",
    "74": "jorge/DZP-ZORA.1.element.json",
    "75": "jorge/DZP-ZORA.1.element.json",
    "76": "jorge/DZP-ZORA.1.element.json",
    "77": "jorge/DZP-ZORA.1.element.json",
    "78": "jorge/DZP-ZORA.1.element.json",
    "79": "jorge/DZP-ZORA.1.element.json",
    "80": "jorge/DZP-ZORA.1.element.json",
    "81": "jorge/DZP-ZORA.1.element.json",
    "82": "jorge/DZP-ZORA.1.element.json",
    "83": "jorge/DZP-ZORA.1.element.json",
    "84": "jorge/DZP-ZORA.1.element.json",
    "85": "jorge/DZP-ZORA.1.element.json",
    "86": "jorge/DZP-ZORA.1.element.json",
    "87": "jorge/DZP-ZORA.1.element.json",
    "88": "jorge/DZP-ZORA.1.element.json",
    "89": "jorge/DZP-ZORA.1.element.json"
  }
}