{
  "molssi_bse_schema": {
    "schema_type": "table",
    "schema_version": "0.1"
  },
  "revision_description": "Data from supporting information; re-added d-type ECP on F with vanishingly small coefficient to ensure basis is correctly parsed in all programs",
  "revision_date": "2024-08-17",
  "elements": {
    "1": "grimme/vdzp.1.element.json",
    "2": "grimme/vdzp.1.element.json",
    "3": "grimme/vdzp.1.element.json",
    "4": "grimme/vdzp.1.element.json",
    "5": "grimme/vdzp.1.element.json",
    "6": "grimme/vdzp.1.element.json",
    "7": "grimme/vdzp.1.element.json",
    "8": "grimme/vdzp.1.element.json",
    "9": "grimme/vdzp.1.element.json",
    "10": "grimme/vdzp.1.element.json",
    "11": "grimme/vdzp.1.element.json",
    "12": "grimme/vdzp.1.element.json",
    "13": "grimme/vdzp.1.element.json",
    "14": "grimme/vdzp.1.element.json",
    "15": "grimme/vdzp.1.element.json",
    "16": "grimme/vdzp.1.element.json",
    "17": "grimme/vdzp.1.element.json",
    "18": "grimme/vdzp.1.element.json",
    "19": "grimme/vdzp.1.element.json",
    "20": "grimme/vdzp.1.element.json",
    "21": "grimme/vdzp.1.element.json",
    "22": "grimme/vdzp.1.element.json",
    "23": "grimme/vdzp.1.element.json",
    "24": "grimme/vdzp.1.element.json",
    "25": "grimme/vdzp.1.element.json",
    "26": "grimme/vdzp.1.element.json",
    "27": "grimme/vdzp.1.element.json",
    "28": "grimme/vdzp.1.element.json",
    "29": "grimme/vdzp.1.element.json",
    "30": "grimme/vdzp.1.element.json",
    "31": "grimme/vdzp.1.element.json",
    "32": "grimme/vdzp.1.element.json",
    "33": "grimme/vdzp.1.element.json",
    "34": "grimme/vdzp.1.element.json",
    "35": "grimme/vdzp.1.element.json",
    "36": "grimme/vdzp.1.element.json",
    "37": "grimme/vdzp.1.element.json",
    "38": "grimme/vdzp.1.element.json",
    "39": "grimme/vdzp.1.element.json",
    "40": "grimme/vdzp.1.element.json",
    "41": "grimme/vdzp.1.element.json",
    "42": "grimme/vdzp.1.element.json",
    "43": "grimme/vdzp.1.element.json",
    "44": "grimme/vdzp.1.element.json",
    "45": "grimme/vdzp.1.element.json",
    "46": "grimme/vdzp.1.element.json",
    "47": "grimme/vdzp.1.element.json",
    "48": "grimme/vdzp.1.element.json",
    "49": "grimme/vdzp.1.element.json",
    "50": "grimme/vdzp.1.element.json",
    "51": "grimme/vdzp.1.element.json",
    "52": "grimme/vdzp.1.element.json",
    "53": "grimme/vdzp.1.element.json",
    "54": "grimme/vdzp.1.element.json",
    "55": "grimme/vdzp.1.element.json",
    "56": "grimme/vdzp.1.element.json",
    "57": "grimme/vdzp.1.element.json",
    "58": "grimme/vdzp.1.element.json",
    "59": "grimme/vdzp.1.element.json",
    "60": "grimme/vdzp.1.element.json",
    "61": "grimme/vdzp.1.element.json",
    "62": "grimme/vdzp.1.element.json",
    "63": "grimme/vdzp.1.element.json",
    "64": "grimme/vdzp.1.element.json",
    "65": "grimme/vdzp.1.element.json",
    "66": "grimme/vdzp.1.element.json",
    "67": "grimme/vdzp.1.element.json",
    "68": "grimme/vdzp.1.element.json",
    "69": "grimme/vdzp.1.element.json",
    "70": "grimme/vdzp.1.element.json",
    "71": "grimme/vdzp.1.element.json",
    "72": "grimme/vdzp.1.element.json",
    "73": "grimme/vdzp.1.element.json",
    "74": "grimme/vdzp.1.element.json",
    "75": "grimme/vdzp.1.element.json",
    "76": "grimme/vdzp.1.element.json",
    "77": "grimme/vdzp.1.element.json",
    "78": "grimme/vdzp.1.element.json",
    "79": "grimme/vdzp.1.element.json",
    "80": "grimme/vdzp.1.element.json",
    "81": "grimme/vdzp.1.element.json",
    "82": "grimme/vdzp.1.element.json",
    "83": "grimme/vdzp.1.element.json",
    "84": "grimme/vdzp.1.element.json",
    "85": "grimme/vdzp.1.element.json",
    "86": "grimme/vdzp.1.element.json"
  }
}