{
  "molssi_bse_schema": {
    "schema_type": "table",
    "schema_version": "0.1"
  },
  "revision_description": "Data from Supplementary Material",
  "revision_date": "2024-07-15",
  "elements": {
    "1": "ranasinghe/4zap.1.element.json",
    "6": "ranasinghe/4zap.1.element.json",
    "7": "ranasinghe/4zap.1.element.json",
    "8": "ranasinghe/4zap.1.element.json",
    "9": "ranasinghe/4zap.1.element.json"
  }
}