{
  "molssi_bse_schema": {
    "schema_type": "table",
    "schema_version": "0.1"
  },
  "revision_description": "Data from supporting information",
  "revision_date": "2024-02-20",
  "elements": {
    "1": "paw/paw-l2-contracted.1.element.json",
    "3": "paw/paw-l2-contracted.1.element.json",
    "4": "paw/paw-l2-contracted.1.element.json",
    "5": "paw/paw-l2-contracted.1.element.json",
    "6": "paw/paw-l2-contracted.1.element.json",
    "7": "paw/paw-l2-contracted.1.element.json",
    "8": "paw/paw-l2-contracted.1.element.json",
    "9": "paw/paw-l2-contracted.1.element.json",
    "11": "paw/paw-l2-contracted.1.element.json",
    "12": "paw/paw-l2-contracted.1.element.json",
    "13": "paw/paw-l2-contracted.1.element.json",
    "14": "paw/paw-l2-contracted.1.element.json",
    "15": "paw/paw-l2-contracted.1.element.json",
    "16": "paw/paw-l2-contracted.1.element.json",
    "17": "paw/paw-l2-contracted.1.element.json"
  }
}